,Doença, Sintomas;
"0, psoríase, ""Eu tenho experimentado uma erupção cutânea nos braços, pernas e tronco nas últimas semanas. É vermelho, coceira e coberto de manchas secas e escamosas"".";
"1, psoríase, ""minha pele está descascando, especialmente nos joelhos, cotovelos e couro cabeludo. Essa descamação é frequentemente acompanhada por uma sensação de queimação ou picada"".";
"2, psoríase: ""Eu tenho sofrido dor nas articulações nos dedos, pulsos e joelhos. A dor é muitas vezes dolorida e latejante, e fica pior quando movo minhas articulações"".";
"3, psoríase, ""há uma prata como espanar na minha pele, especialmente na parte inferior das costas e no couro cabeludo. Esse pó é composto de pequenas escamas que se espalham facilmente quando eu as arranham"".";
"4, psoríase, ""minhas unhas têm pequenas amolgadelas ou poços, e eles geralmente se sentem inflamatórios e tenros ao toque. Mesmo há pequenas erupções cutâneas nos meus braços"".";
5, psoríase, a pele nas minhas palmeiras e solas está espessada e tem rachaduras profundas.Essas rachaduras são dolorosas e sangrando facilmente.;
"6, psoríase, ""A pele ao redor da minha boca, nariz e olhos está vermelha e inflamada. Muitas vezes, é coceira e desconfortável. Há uma inflamação notável nas minhas unhas"".";
7, psoríase, minha pele é muito sensível e reage facilmente a mudanças de temperatura ou umidade.Costumo ter que ter cuidado com os produtos que uso na minha pele.;
"8, psoríase, ""notei uma descascamento repentina da pele em diferentes partes do meu corpo, principalmente braços, pernas e costas. Além disso, enfrento dores nas articulações e erupções cutâneas"".";
"9, psoríase, ""A pele nos meus órgãos genitais é vermelha e inflamada. Muitas vezes, é coceira, queimando e desconfortável. Há erupções cutâneas em diferentes partes do corpo também"".";
"10, psoríase: ""Eu experimentei fadiga e um sentimento geral de mal -estar. Muitas vezes me sinto cansado e tenho falta de energia, mesmo depois de uma boa noite de sono"".";
"11, psoríase, ""A erupção cutânea na minha pele se espalhou para outras partes do meu corpo, incluindo meu peito e abdômen. É coceira e desconfortável, e geralmente é pior à noite. Também estou enfrentando descascamento da pele"".";
12, psoríase, a erupção na minha pele é pior nos meses de inverno, quando o ar está seco.Acho que tenho que hidratar com mais frequência e usar umidificadores para manter minha pele hidratada.;
"13, psoríase, ""tive dificuldade em dormir devido à coceira e desconforto causados ​​pela erupção cutânea. Existem pequenos amassados ​​nas unhas, o que é realmente preocupante"".";
"14, psoríase: ""Minha pele é propensa a infecções devido a manchas secas e escamosas. Estou sentindo uma forte dor nas articulações. A pele nos joelhos e cotovelos está começando a se retirar"".";
"15, psoríase: ""Estou começando a ter erupções cutâneas na minha pele. A erupção cutânea geralmente sangra quando eu arranho ou esfrego. Além disso, notei pequenas amolas nas unhas"".";
"16, psoríase: ""Percebi que minha pele se tornou mais sensível do que costumava ser. Há uma prata como espanar na minha pele, especialmente nas minhas costas e cotovelos"".";
"17, psoríase, ""Estou preocupado com a descascamento constante da pele na palma da mão, cotovelo e joelho. Eu desenvolvi erupções cutâneas nos braços, o que coça se eu os tocar. Tudo isso está deixando minha vida bastante desconfortável e infeliz"".";
"18, psoríase: ""Há uma dor estranha nas minhas articulações. Além disso, notei uma estranha descascamento da pele em diferentes partes do meu corpo. Receio que haja algo errado acontecendo no meu corpo"".";
"19, psoríase, ""minhas unhas têm pequenas amolgadelas. Até minhas articulações começaram a dor severamente. Há uma prata como espanar na minha pele, principalmente nas costas"".";
"20, psoríase, ""As erupções cutâneas na minha pele não estão se curando. Além disso, notei uma descascamento repentina da pele, especialmente a pele nos cotovelos e joelhos. Estou realmente preocupado com isso"".";
"21, psoríase, ""Nas últimas semanas, tive uma erupção cutânea nos braços, pernas e peito. É vermelho e irritante, com pontos secos e escamosos. Também tenho uma dor estranha nas articulações"".";
"22, psoríase: ""Minha pele está descascando, principalmente de joelhos, cotovelos e couro cabeludo. Essa descamação é frequentemente acompanhada por uma sensação de picada ou ardente"".";
"23, psoríase, ""Estou com desconforto articular nos dedos, pulsos e joelhos. A dor é frequentemente dolorida e latejante, e piora quando movo minhas articulações"".";
"24, psoríase: ""Minha pele tem um filme prateado, particularmente nas costas, braços e couro cabeludo. Esse pó é composto de escalas minúsculas que facilmente descascam quando arranhadas"".";
"25, psoríase: ""Eu tenho uma pele vermelha e inflamatória ao redor da boca, nariz e olhos. É frequentemente irritante e desagradável. Recentemente, ficou muito doloroso"".";
26, psoríase, minha pele é extremamente sensível e rapidamente irritada por mudanças de temperatura ou umidade.Minhas unhas desenvolveram dentes neles.Estou preocupado com essa mudança repentina.;
"27, psoríase: ""Eu vi uma repentina descamação da pele em várias regiões do meu corpo, principalmente meus braços, pernas e costas. Além disso, tenho dor nas articulações significativas e erupções cutâneas. A erupção cutânea está se espalhando para diferentes partes do meu corpo"".";
"28, psoríase, ""minha pele genital é vermelha e irritada. É frequentemente irritante, queimada e desagradável. Também há erupções cutâneas em vários lugares do corpo. Além disso, tenho uma dor estranha nas minhas articulações"".";
"29, psoríase, ""tive problemas para dormir por causa da coceira e dor produzida pela erupção cutânea. Minhas unhas têm pequenas amolgadelas, o que é realmente alarmante. Há uma inflamação perceptível nas minhas unhas"".";
"30, psoríase, ""Por causa de áreas secas e escamosas na minha pele, estou propenso a infecções. Minhas articulações estão em agonia excruciante. A pele dos meus joelhos e cotovelos está começando a flocos"".";
"31, psoríase: ""Minha pele está explodindo em erupções cutâneas. Quando eu arranho ou esfrego a erupção cutânea, ela costuma sangrar. Além disso, observei pequenas amolgadelas nas unhas. Há uma inflamação perceptível nas minhas unhas"".";
"32, psoríase: ""Observei que minha pele é mais sensível agora do que costumava ser. Minha pele tem um filme prateado, especialmente nas minhas costas e cotovelos"".";
"33, psoríase: ""Minhas palmas das mãos e solas cresceram e desenvolveram fissuras graves. Essas rachaduras são desagradáveis ​​e freqüentemente sangem. Além disso, a pele está começando a se retirar"".";
"34, psoríase: ""Minhas unhas estão começando a ter pequenos poços. Estou preocupado e não sei o que está causando.";
"35, psoríase, ""Há uma prata como tirar o pó na minha pele. Além disso, a pele nos meus braços e as costas está começando a se retirar. Isso é estranho e realmente preocupante para mim"".";
"36, psoríase: ""Minha erupção cutânea se estendeu a outras áreas do meu corpo, incluindo meu peito e barriga. É irritante e desagradável, e é frequentemente pior à noite. Também estou experimentando descamação da pele"".";
"37, psoríase: ""Minha erupção cutânea piora no inverno quando o ar está seco. Para manter minha pele hidratada, tenho que hidratar mais regularmente e usar umidificadores. Também estou enfrentando dor nas articulações"".";
38, psoríase, tive problemas para dormir por causa da coceira e dor produzida pela erupção cutânea.Minhas unhas têm pequenas amolgadelas.Também estou experimentando descascamento da pele em diferentes partes do meu corpo.;
"39, psoríase: ""Minha pele está descascando em alguns lugares, especialmente nos joelhos, cotovelos e braços. Esse descascamento é frequentemente acompanhado por uma sensação dolorosa ou queimada. Também estou desenvolvendo pequenos amolgadelas nas unhas, o que é realmente preocupante"".";
"40, psoríase: ""Minha pele tem uma camada prateada sobre ela, especialmente nas minhas costas e nos braços. Esse pó é composto de pequenas escamas que retiram prontamente quando esfregadas. Além disso, há erupções em todo o meu corpo"".";
"41, psoríase: ""Meus braços, rosto e costas são todos vermelhos e irritados. É frequentemente irritante e desagradável. Minhas unhas têm uma inflamação estranha e desenvolveram pequenos amolgadelas. Nunca vi nada assim"".";
"42, psoríase, ""tive problemas para dormir por causa da coceira e dor produzida pela erupção cutânea. Minhas unhas têm pequenas amolgadelas, o que é realmente alarmante. Além disso, minhas articulações da dor todos os dias e não tenho idéia do que está causando isso"".";
43, psoríase, meus dedos e solas têm uma pele bastante grossa que é rachada severamente.Essas fraturas doem e sangraram com frequência.As fraturas são coceiras e cobertas com escamas.;
"44, psoríase, ""minha pele mudou de ser menos sensível para ser mais sensível. Minha pele tem um revestimento prateado, especialmente nas minhas costas, cotovelos e joelhos"".";
"45, psoríase, ""minhas unhas estão ligeiramente amassadas. Até minhas articulações agora estão experimentando desconforto excruciante. Minha pele tem um pó de prata, especialmente nas minhas costas e cotovelos"".";
"46, psoríase, ""tive problemas para adormecer por causa da dor e coceira da erupção cutânea. A pele dos meus dedos está começando a se soltar. Minhas unhas têm algumas rachaduras pequenas, o que é realmente preocupante"".";
"47, psoríase, ""minhas articulações estão experimentando um desconforto incomum. Além disso, experimentei descascando a pele estranha em vários lugares do meu corpo. Estou preocupado que algo esteja errado com meu corpo"".";
"48, psoríase, ""Estou começando a ter erupções cutâneas nos braços e no pescoço. A erupção cutânea geralmente sangra e dói quando o coço. Também desenvolvi pequenos amolgadeiras nas unhas, o que é muito estranho"".";
"49, psoríase, ""Por causa de áreas secas e escamosas na minha pele, estou propenso a infecções. Minhas articulações estão com dor extrema. Meus joelhos e a pele dos cotovelos estão começando a descascar"".";
"50, veias varicosas: ""Eu tenho uma erupção cutânea nas pernas que está causando muitos desconfortos. Parece que há uma cãibra e posso ver veias proeminentes na panturrilha. Além disso, estou me sentindo muito cansado e cansado nos últimos dois dias"".";
"51, varizes veias: ""Meus panturrilhas estão se apertando quando eu ando ou mantenho longos períodos de tempo. Há marcas de machucado nas panturrilhas, o que está me preocupando. Sinto -me cansado muito em breve"".";
"52, veias varicosas: ""Há hematomas nas minhas pernas que não posso explicar. Eu posso ver vasos sanguíneos estranhos abaixo da pele. Além disso, sou um pouco obeso e estou realmente preocupado"".";
53, veias varicosas, estou acima do peso e notei que minhas pernas estão inchadas e os vasos sanguíneos são visíveis.Minhas pernas estão inchadas e eu posso ver um fluxo de veias inchadas nas minhas panturrilhas.;
"54, as varizes veias, ""as veias nos meus panturrilhas se tornaram muito proeminentes e causando desconforto. Não consigo suportar longos períodos de tempo, pois causa dor nas pernas, semelhante às cãibras"".";
55, varizes, a pele ao redor das veias nas minhas pernas é vermelha e inflamada.Eu acredito que posso ver alguns dos vasos sanguíneos inchados.Estou realmente preocupado com isso.;
56, as varizes, em pé ou andando por longos períodos de tempo, causam muita dor nas minhas pernas.Eu recebo cólicas ao realizar atividades físicas.Há marcas de machucado nas minhas pernas também.;
57, varizes, as cãibras nas minhas panturrilhas estão dificultando a caminhada.Sinto -me cansado depois de trabalhar por algum tempo.Eu acredito que a obesidade é a razão por trás disso.;
"58, veias varicosas: ""O inchaço nas minhas pernas piorou nas últimas semanas. Agora, um grande número de veias é perceptível em meus panturrilhas, o que está me preocupando"".";
59, varizes, as veias nas minhas pernas são muito perceptíveis e me causam desconforto.Parece que há uma grande contusão e eu recebo cólicas quando corro.;
60, varizes, a pele em meus panturrilhas ficou inflamada e vermelha.Minhas pernas doem se eu tentar correr ou fazer alguma atividade física.;
"61, varizes veias: ""Recentemente, a dor em meus panturrilhas tem sido constante e piora quando me levanto ou ando por longos períodos de tempo. Minhas pernas começaram a inchar e também alguns vasos sanguíneos são bastante perceptíveis"".";
62, varizes, as veias nas minhas pernas estão causando desconforto e dificuldade de dormir à noite.Não tenho ideia de por que isso está acontecendo.Eu recebo cólicas quando corro.;
63, varizes, o inchaço nas minhas pernas está me fazendo ter dificuldade em me encaixar nos meus sapatos.Não consigo correr ou permanecer por longos períodos de tempo.Eu posso ver alguns vasos sanguíneos inchados.;
64, varizes, notei cólicas em meus panturrilhas estão se tornando mais frequentes e intensos.Está me causando muitos desconfortos.Eu também estou acima do peso e minhas pernas começaram a inchar.;
65, varizes, as veias nas minhas pernas causam muitos desconfortos quando me sento por longos períodos de tempo.;
66, varizes, a erupção cutânea nas minhas pernas está se espalhando e se tornando mais graves.Tornou -se muito difícil para mim correr.;
67, varizes, minhas pernas estão causando muitos desconfortos quando eu me exercito.Eu recebo cólicas frequentes e os vasos sanguíneos se tornaram bastante perceptíveis.;
68, varizes, os vasos sanguíneos proeminentes nos meus panturrilhas estão causando autoconsciência e vergonha.Eu acredito que o problema é por causa do meu excesso de peso.;
69, varizes, a pele ao redor das veias nas minhas pernas é seca e escamosa.Parece que há uma contusão importante e minhas pernas começaram a inchar.;
70, veias varicosas, tenho experimentado uma erupção cutânea nas pernas que estão causando muita irritação e desconforto.É vermelho e inflamado e parece estar se espalhando.;
"71, varizes veias: ""Recentemente, meus panturrilhas estão cãibilizando com frequência, especialmente quando estou andando ou em pé por longos períodos de tempo. Além disso, as veias são muito perceptíveis"".";
72, varizes, notei que há hematomas nas minhas pernas que não posso explicar.Eles não são dolorosos, mas são preocupantes para mim.;
"73, veias varicosas, ""Como estou acima do peso, notei que minhas pernas estão inchadas e os vasos sanguíneos são mais visíveis do que o habitual. O inchaço parece estar piorando com o tempo"".";
74, as varizes, as veias nos meus panturrilhas são muito proeminentes e estão me causando muitos desconfortos.Eles estão inchados e se projetam da minha pele.;
"75, as varizes veias: ""A pele ao redor das veias nas minhas pernas é vermelha, inflamada e com coceira. Isso está causando muitos desconfortos e estou começando a obter cãibras regulares"".";
76, as varizes, em pé ou andando por longos períodos de tempo, causam muita dor nas minhas pernas.Parece uma cãibra e piora quanto mais tempo estou de pé.;
77, varizes, as cólicas nas minhas panturrilhas têm dificultado a caminhar e fazer minhas atividades diárias.Eles vêm de repente e duram vários minutos.;
78, varizes, o inchaço nas minhas pernas piorou nas últimas semanas e está me causando dificuldade em me encaixar no meu lugar.Também está causando desconforto quando me sento por longos períodos de tempo.;
"79, veias varicosas: ""As veias nas minhas pernas são muito perceptíveis e estão me causando muitos desconfortos. Eles estão inchados e se projetavam da minha pele, tornando -os visíveis através das minhas roupas"".";
"80, as varizes veias: ""A pele nas minhas panturrilhas está com coceira e inflamada, causando muito desconforto e dificuldade para dormir à noite. Os vasos sanguíneos começaram a se projetar, o que é preocupante"".";
81, varizes, a dor nas panturrilhas é constante e piora quando me levanto ou ando por longos períodos de tempo.Estou recebendo cólicas constantes e não posso correr por períodos mais longos.;
"82, varizes veias: ""As veias nas minhas pernas estão causando desconforto e dificuldade de dormir à noite. Eles estão inchados e se saindo da minha pele, tornando -os notáveis ​​e dolorosos"".";
83, varizes, o inchaço nas minhas pernas está me fazendo ter dificuldade em me encaixar nos sapatos e está causando desconforto quando me sento por longos períodos de tempo.;
"84, varizes veias: ""As cólicas nas minhas panturrilhas estão se tornando mais frequentes e intensas, dificultando a caminhar e fazer minhas atividades diárias"".";
"85, varizes veias: ""As veias nas minhas pernas estão causando muitos desconfortos quando me sento por longos períodos de tempo. Eles estão inchados e se saindo da minha pele, tornando -os dolorosos e notáveis"".";
"86, varizes veias: ""A erupção cutânea nas minhas pernas está se espalhando e se tornando mais grave. É vermelho, inflamado e com coceira, causando muito desconforto e dificuldade de dormir à noite"".";
"87, varizes veias: ""Minhas pernas têm causado muitos desconfortos quando eu me exercito. Eles se sentem pesados ​​e inchados, e as veias são proeminentes e dolorosas. Sinto -me cansado o tempo todo"".";
"88, varizes veias: ""As veias proeminentes em meus panturrilhas estão causando autoconsciência e constrangimento. Eles estão inchados e se projetam da minha pele, tornando-os muito perceptíveis"".";
"89, varizes veias: ""A pele ao redor das veias nas minhas pernas é seca e escamosa, causando desconforto e irritação. Também estou começando a obter cólicas frequentes"".";
"90, varizes veias: ""Eu tenho uma erupção cutânea nas pernas que está me dando muita dor. Parece haver uma cãibra e posso ver veias visíveis na panturrilha"".";
91, varizes, minhas veias de pernas se tornaram mais visíveis e inchadas do que o normal.Eles são visíveis através da minha pele e dói quando eu me movo.;
"92, veias varicosas: ""Caminhar é difícil para mim por causa de cólicas em meus panturrilhas. A obesidade, acredito, é a causa disso. Depois de um tempo trabalhando, estou exausto"".";
93, varizes, os vasos sanguíneos nas minhas pernas são bastante visíveis e me dão muita dor.Eles são grandes e se projetaram da minha pele.É incomum e estou preocupado com isso.;
"94, varizes veias: ""Percebi que os vasos sanguíneos nas minhas pernas estão ficando mais visíveis do que o habitual. É um pouco preocupante para mim. Além disso, estou experimentando cãibras todos os dias"".";
95, veias varicosas, o inchaço das minhas pernas ficou pior nos últimos dois dias.Eu posso ver os vasos sanguíneos saindo da pele.Isso é bastante incomum.;
96, varizes, longas durações de pé ou caminhada causaram desconforto grave nas minhas pernas.É uma dor ardente que piora quanto mais tempo estou de pé.;
"97, varizes veias: ""A pele das minhas pernas ao redor das veias é incomum. Parece haver uma contusão grande. Hoje em dia, recebo cólicas frequentes quando corro ou corro"".";
"98, veias varicosas: ""Estou experimentando muitas cólicas nos últimos dois dias. Acho que algo não está certo. Acredito que haja uma pequena contusão nas panturrilhas, mas não tenho certeza sobre isso"".";
"99, varizes veias: ""As veias nas minhas panturrilhas estão saindo de maneira bastante incomum. Estou preocupado com isso. Além disso, estou acima do peso e acredito que essa é a razão por trás de tudo isso"".";
"100, Tifóide, ""Tenho constipação e dor na barriga, e tem sido realmente desconfortável. A dor na barriga está piorando e está começando a afetar minha vida diária. Além disso, fico calafrios todas as noites, seguido por uma febre suave"".";
"101, Tifóide, ""Eu também tive alguma diarréia, que tem sido realmente desagradável. Está vindo e vindo, e foi acompanhado por cólicas abdominais e inchaço"".";
"102, tifóide: ""Eu tenho sofrido calafrios e febre, juntamente com dor abdominal intensa. Estou me sentindo realmente infeliz no geral, e eu simplesmente não consigo abalar esses sintomas"".";
103, tifóide, tenho tido muitos problemas para me manter hidratado por causa do vômito e da diarréia.Há uma febre suave junto com constipação e dor de cabeça.;
"104, tifóide: ""Perdi muito peso na semana passada porque não consegui comer muito devido a náusea e vômito. Isso é seguido por febre suave, dor de cabeça e dor na barriga. Estou realmente preocupado com minha saúde"".";
"105, Tifóide, ""A fadiga tem sido realmente desconfortável, e tive muitas dificuldades para realizar minhas atividades habituais. Também estou me sentindo realmente deprimido e irritado. Há uma dor leve na parte abdominal também"".";
"106, Tifóide, ""tive uma dor de cabeça persistente na semana passada, e está piorando. Ele foi acompanhado por dores de barriga, constipação e diarréia"".";
"107, Tifóide, ""Eu tenho sofrido febre alta, especialmente à noite. Tem sido realmente desconfortável. Há uma leve dor de cabeça junto com constipação e diarréia"".";
"108, Tifóide, ""Eu tenho muita dificuldade em respirar, e sinto que estou constantemente enjoado. Também tenho uma dor de barriga leve. É aterrorizante às vezes"".";
"109, Tifóide, ""A diarréia tem sido realmente aquosa e com cheiro sujo, e é acompanhado pela dor abdominal. Sinto vontade de vomitar a maior parte do tempo"".";
"110, Tifóide, ""Estou tendo muitos problemas para dormir por causa da febre alta, dor de cabeça e arrepios. Eu acordo todos os dias com uma dor terrível na área da barriga"".";
"111, Tifóide, ""Eu também tenho experimentado um pouco de diarréia e constipação, o que tem sido realmente preocupante. Parece uma dor nítida e esfaqueada na área da barriga. Sinto -me cansado o tempo todo"".";
"112, Tifóide: ""Eu tive alguma constipação e dor na barriga, o que tem sido realmente desconfortável. A dor está piorando e está realmente afetando minha vida diária"".";
"113, Tifóide, ""Estou experimentando muita dor e constipação da barriga, o que tem sido realmente irritante. Às vezes, sinto um forte desejo de vomitar e, por causa de tudo isso, estou me sentindo muito fraco"".";
"114, Tifóide, ""A dor abdominal está vindo e vindo, e tem sido realmente desagradável. Ela foi acompanhada de constipação e vômito. Sinto -me realmente preocupado com minha saúde"".";
"115, tifóide: ""Eu tenho experimentado muito inchaço e constipação, e tem sido realmente desconfortável. Parece que há muita pressão e dor na minha área de barriga"".";
"116, Tifóide, ""Estou experimentando extrema dor e constipação da barriga. Todas as noites, tenho uma febre severa junto com calafrios e dores de cabeça. Os últimos dois dias foram realmente desconfortáveis"".";
"117, tifóide: ""Estou me sentindo exausto e fraco, e não consigo me livrar disso. Por causa dos vômitos e náusea, perdi inteiramente meu apetite. Minhas dores na barriga que estão me causando preocupação"".";
"118, Tifóide, ""Estou experimentando constipação e dor de estômago, o que tem sido realmente difícil. O desconforto piorou e está seriamente interferindo na minha vida cotidiana"".";
"119, Tifóide, ""Por causa dos vômitos e da diarréia, tenho tido muitas dificuldades em me manter hidratado. Tenho febre alta, além de constipação e dor de cabeça"".";
120, tifóide, a dor abdominal tem sido frequente e muito dolorosa.Constipação e vômito também ocorreram.Estou bastante preocupado com minha saúde.;
"121, tifóide: ""Estou com dores e constipação de estômago seveas. Todas as noites, sinto dor de cabeça e arrepios. Os últimos dias foram muito dolorosos"".";
122, tifóide, há uma dor distinta na minha parte abdominal.Não tenho certeza do que é.Também estou passando por vômitos constantes e me sinto enjoado.;
"123, Tifóide, ""A diarréia tem sido bastante fluida e fedorenta, e foi acompanhada por dor abdominal e dor de cabeça severa. Na maioria das vezes, sinto -me como vômito"".";
"124, tifóide: ""Eu tive febre nos últimos dois dias. Agora, estou começando a sentir uma dor intensa na área do estômago e sofrendo de constipação"".";
"125, Tifóide, ""Estou experimentando muita náusea e vômito, e tem sido bastante difícil para mim comer qualquer coisa. Perdi completamente meu apetite e, como resultado, fiquei bastante fraco"".";
"126, tifóide: ""Estou tendo muitos problemas para dormir por causa da febre alta e da dor de cabeça. Além disso, tenho dores constantes da barriga, por causa das quais não posso ir trabalhar"".";
"127, tifóide: ""Estou me sentindo realmente cansado e fraco, e não consigo me livrar disso. Tenho uma febre suave e uma dor estranha na minha área abdominal. Não consigo entender o que está acontecendo"".";
"128, Tifóide, ""Eu tenho sofrido de constipação e desconforto estomacal, o que foi realmente desconfortável. Na noite passada, eu também tive uma febre suave"".";
"129, tifóide: ""Eu também sofro de diarréia, o que tem sido realmente desconfortável. Ele vem e vai, e é acompanhado por dores de estômago e vômito"".";
"130, Tifóide, ""Eu tenho sofrido calafrios, febre e desconforto estomacal extremo. Fiquei geralmente infeliz e não consigo me livrar desses sintomas"".";
