,Doença, Sintomas;
174, hemorróidas dimórficas, estou tendo muitos problemas ao banheiro e é muito doloroso quando o fizer.Meu banquinho está sangrento e tive alguma dor na minha bunda.Meu ânus tem sido realmente coceira e irritado também.;
175, hemorróidas dimórficas, estou tendo problemas para ir ao banheiro.Tem sido realmente difícil de ir e dói quando eu fizer.Meu ânus está realmente dolorido e está sangrando quando vou.É muito doloroso e estou muito desconfortável.;
"176, hemorróidas dimórficas: ""Eu tenho achado difícil usar o banheiro. Ir foi bastante difícil e dói quando eu faço. Quando vou, meu ânus sangra e é realmente desconfortável. Estou muito desconfortável e dói extremamente ruim"".";
"177, hemorróidas dimórficas: ""Estou tendo dificuldade em usar o banheiro. Tem sido difícil ir, e dói quando eu faço. Meu ânus é bastante doloroso e está sangrando sempre que vou. É terrivelmente doloroso e estou bastante desconfortável"".";
178, hemorróidas dimórficas, ultimamente eu tenho experimentado constipação e dor durante os movimentos intestinais.Meu ânus está realmente dolorido e está sangrando quando vou.É muito doloroso e estou muito desconfortável.;
"179, hemorróidas dimórficas: ""Recentemente, tenho sofrido de constipação e desconforto digestivo. Meu ânus é bastante doloroso e está sangrando sempre que vou. É terrivelmente doloroso e estou bastante desconfortável"".";
"180, Hemorróidas dimórficas, ""Constipação e dor com movimentos intestinais estão me incomodando ultimamente. Quando vou, meu ânus sangra e é realmente desconfortável. Estou muito desconfortável e dói extremamente ruim"".";
181, hemorróidas dimórficas, tenho tido muitos problemas com os movimentos intestinais ultimamente.É difícil ir e dói quando eu fizer.Meu ânus está realmente dolorido e está sangrando quando vou.É muito doloroso e estou muito desconfortável.;
"182, hemorróidas dimórficas: ""Os movimentos do meu intestino têm sido realmente difíceis para mim recentemente. Ir é difícil e dói quando eu faço. Quando vou, meu ânus sangra e é realmente desconfortável. Estou com muito desconforto e dói extremamente ruim"".";
"183, hemorróidas dimórficas: ""Eu tenho experimentado muitos problemas de movimento intestinal recentemente. É difícil ir, e dói quando eu faço. Meu ânus é bastante doloroso e está sangrando sempre que vou. É terrivelmente doloroso e estou muito desconfortável"".";
184, hemorróidas dimórficas, estou tendo muitos problemas com os movimentos intestinais ultimamente.É difícil ir e dói quando eu fizer.Meu ânus está realmente dolorido e está sangrando quando vou.É muito doloroso e estou muito desconfortável.;
"185, hemorróidas dimórficas: ""Eu tenho enfrentado muitos problemas com os movimentos do meu intestino recentemente. É difícil ir, e dói quando eu faço. Meu ânus é bastante doloroso e estou sangrando sempre que vou. É terrivelmente doloroso e desconfortável"".";
"186, hemorróidas dimórficas: ""Os movimentos do meu intestino estão me dando muitos problemas agora. Ir é difícil, e ir dói quando eu o faço. Quando vou, meu ânus sangra e é realmente desconfortável. Estou muito desconfortável e dói extremamente ruim"".";
187, hemorróidas dimórficas, ultimamente eu tenho experimentado constipação e dor durante os movimentos intestinais.Meu ânus está realmente dolorido e está sangrando quando vou.É muito doloroso e estou muito desconfortável.;
"188, hemorróidas dimórficas: ""Eu tenho constipação e movimentos intestinais que doem recentemente. Quando vou, meu ânus sangra e é realmente desconfortável. Estou muito desconforado e dói extremamente ruim"".";
"189, hemorróidas dimórficas: ""Recentemente, tenho sofrido de constipação e desconforto digestivo. Meu ânus é bastante doloroso e está sangrando sempre que vou. É terrivelmente doloroso e estou bastante desconfortável"".";
"190, hemorróidas dimórficas: ""Eu tenho experimentado muitos problemas de movimento intestinal recentemente. É difícil ir, e dói quando eu faço. Meu ânus é bastante doloroso e está sangrando sempre que vou. É terrivelmente doloroso e estou muito desconfortável"".";
191, hemorróidas dimórficas, estou tendo muitos problemas com os movimentos intestinais ultimamente.É difícil ir e dói quando eu fizer.Meu ânus está realmente dolorido e está sangrando quando vou.É muito doloroso e estou muito desconfortável.;
"192, hemorróidas dimórficas: ""Os movimentos do meu intestino têm sido realmente difíceis para mim recentemente. Ir é difícil e dói quando eu faço. Quando vou, meu ânus sangra e é realmente desconfortável. Estou com muito desconforto e dói extremamente ruim"".";
"193, hemorróidas dimórficas: ""Eu tenho enfrentado muitos problemas com os movimentos do meu intestino recentemente. É difícil ir, e dói quando eu faço. Meu ânus é bastante doloroso e estou sangrando sempre que vou. É terrivelmente doloroso e desconfortável"".";
"194, hemorróidas dimórficas: ""Eu tenho experimentado muitos problemas de movimento intestinal recentemente. É difícil ir, e dói quando eu faço. Meu ânus é bastante doloroso e está sangrando sempre que vou. É muito doloroso e realmente desconfortável"".";
"195, hemorróidas dimórficas: ""Eu tenho recebido muitos problemas intestinais recentemente. É difícil para mim ir e dói quando eu faço. Meu ânus é bastante doloroso e está sangrando sempre que vou. É terrivelmente doloroso e estou muito desconfortável"".";
196, hemorróidas dimórficas, tenho tido muito dificuldade em ir ao banheiro recentemente.É muito doloroso e só consigo ir a cada poucos dias.Há também muita dor no meu ânus e em torno dessa área.Meu banquinho tem sido realmente sangrento e meu ânus se sente realmente irritado.;
"197, hemorróidas dimórficas: ""Eu tenho achado incrivelmente difícil recentemente usar o banheiro. Só posso ir esporadicamente porque dói muito. Meu ânus e a região circundante também são bastante dolorosos. Meu ânus se sente realmente agravado, e meu banquinho tem sido extremamente sangrento"".";
198, Hemorróidas dimórficas, estou tendo muitos problemas com constipação e dor enquanto tento ir ao banheiro.Dói muito no meu ânus e na área ao seu redor.Meu banquinho está sangrento e meu ânus está realmente irritado.;
"199, hemorróidas dimórficas: ""Constipação e desconforto do movimento intestinal têm sido muito comuns para mim ultimamente. A região que cercava meu ânus e eu doi muito. Meu ânus está realmente coceira e meu banquinho está sangrento"".";
"200, Artrite: ""Meus músculos estão se sentindo muito fracos e meu pescoço tem sido extremamente apertado. Eu tenho experimentado muita rigidez quando ando e minhas articulações estão inchadas. A caminhada também foi realmente desconfortável"".";
201, artrite, estou me sentindo muito fraco nos meus músculos e meu pescoço tem sido muito rígido.Minhas articulações estão inchando e eu tenho muita rigidez quando me movo.Também tem sido muito doloroso andar.;
"202, Artrite: ""Meus músculos foram bastante fracos e meu pescoço foi muito rígido. Minhas articulações estão inchadas e eu tenho experimentado muita rigidez quando me movo. A caminhada também foi terrivelmente desconfortável"".";
203, Artrite, eu tenho me sentido muito fraco nos meus músculos e meu pescoço tem sido muito rígido.Minhas articulações estão inchando e tem sido difícil se movimentar.Caminhar tem sido muito doloroso.;
"204, Artrite: ""Meus músculos foram realmente fracos e meu pescoço foi extremamente rígido. Minhas articulações estão inchadas, dificultando a mudança. A caminhada foi terrivelmente desconfortável"".";
"205, Artrite, ""Eu tenho experimentado uma fraqueza muscular grave e meu pescoço tem sido muito rígido. Tem sido difícil se movimentar desde que minhas articulações estão inchadas. Foi realmente desconfortável andar"".";
"206, Artrite: ""Meus músculos estão se sentindo muito fracos e meu pescoço tem sido extremamente apertado. Minhas articulações estão inchadas, dificultando a movimentação. Dão muito a andar"".";
"207, Artrite, ""Meu pescoço tem sido tão tenso e sinto que meus músculos são incrivelmente fracos. Tenho problemas para me mover desde que minhas articulações aumentaram. A caminhada tem sido bastante doloroso"".";
"208, Artrite, ""Meu pescoço tem sido muito rígido e tive uma terrível fraqueza muscular. Devido ao inchaço nas minhas articulações, foi um desafio se mover. A caminhada tem sido bastante desagradável"".";
209, artrite, eu tenho me sentido muito fraco nos meus músculos ultimamente e meu pescoço tem sido realmente rígido.Minhas articulações estão inchando e é difícil para mim me movimentar sem me sentir rígido.A caminhada também tem sido muito dolorosa.;
"210, Artrite, ""Recentemente, meus músculos pareciam bastante fracos e meu pescoço foi muito apertado. Eu tenho articulações inchadas e acho difícil se mover sem ficar rígido. Também foi realmente desconfortável andar"".";
"211, Artrite, ""Eu tenho experimentado fraqueza e rigidez muscular recentemente no pescoço. Minhas articulações estão inchadas, dificultando a caminhada sem ficar rígida. A caminhada também foi terrivelmente desconfortável"".";
"212, Artrite, ""Recentemente, tenho sofrido fraqueza e rigidez do músculo do pescoço. Minhas articulações aumentaram e é difícil para mim andar sem me sentir rígido. A caminhada também foi terrivelmente desconfortável"".";
"213, Artrite, ""Ultimamente, meu pescoço tem sido apertado e meus músculos foram enfraquecidos. Tenho articulações inchadas que dificultam a movimentação sem ficar rígido. Também foi agonizantemente doloroso de andar"".";
214, Artrite, eu tenho me sentido muito fraco nos meus músculos e meu pescoço tem sido muito rígido.Minhas articulações estão inchando e é difícil para mim me movimentar sem me sentir rígido.A caminhada também tem sido muito dolorosa.;
"215, Artrite, ""Meus músculos estão se sentindo muito fracos e meu pescoço tem sido extremamente apertado. Eu tenho articulações inchadas e acho difícil se mover sem ficar rígido. Também foi realmente desconfortável de andar"".";
"216, Artrite, ""Meus músculos foram bastante fracos e meu pescoço foi realmente rígido. Minhas articulações estão inchadas, dificultando a caminhada sem ficar rígida. A caminhada também foi terrivelmente desconfortável"".";
"217, Artrite, ""Meus músculos foram realmente fracos e meu pescoço foi extremamente rígido. Minhas articulações estão inchadas, dificultando a caminhar sem me sentir rígido. A caminhada também foi realmente desconfortável"".";
"218, Artrite, ""Meus músculos foram bastante fracos e meu pescoço foi realmente rígido. Minhas articulações estão inchadas, dificultando a movimentação sem ficar rígida. A caminhada também tem sido bastante desconfortável"".";
"219, Artrite, ""Meu pescoço tem sido muito apertado e meus músculos foram bastante fracos. Tenho articulações inchadas que dificultam a movimentação sem ficar rígido. Além disso, a caminhada tem sido bastante desagradável"".";
220, Artrite, eu tenho me sentido muito fraco nos meus músculos e meu pescoço tem sido muito rígido.Minhas articulações estão inchando e é difícil para mim me movimentar sem me sentir rígido.A caminhada também tem sido muito dolorosa.;
"221, Artrite, ""Meus músculos estão se sentindo muito fracos e meu pescoço tem sido extremamente apertado. Eu tenho articulações inchadas e acho difícil se mover sem ficar rígido. Também foi realmente desconfortável de andar"".";
222, artrite, meu pescoço tem sido extremamente apertado e meus músculos estão se sentindo extremamente fracos.É difícil para mim me movimentar sem ficar rígido devido às minhas juntas inchadas.Caminhar também foi extremamente desconfortável.;
"223, Artrite, ""Meu pescoço tem sido extremamente rígido e meus músculos foram extremamente fracos. Como resultado do inchaço nas minhas articulações, acho difícil se movimentar sem se sentir rígido. Além disso, a caminhada tem sido extremamente desconfortável"".";
"224, Artrite, ""Eu tenho experimentado rigidez e fraqueza nos músculos do meu pescoço recentemente. Desde que minhas articulações cresceram, é difícil para mim andar sem ficar rígido. Além disso, a caminhada foi extremamente desconfortável"".";
"225, Artrite, ""Meu pescoço tem sido extremamente apertado e meus músculos estão se sentindo extremamente fracos. Minhas articulações estão inchadas e eu tenho andado com muita rigidez. Além disso, a caminhada tem sido extremamente desconfortável"".";
"226, Artrite, ""Eu tenho experimentado rigidez e fraqueza nos músculos do meu pescoço recentemente. Desde que minhas articulações cresceram, é difícil para mim andar sem ficar rígido. Além disso, a caminhada tem sido extremamente desconfortável"".";
227, Artrite, eu tenho me sentido muito fraco nos meus músculos e meu pescoço tem sido muito rígido.Minhas articulações estão inchando e é difícil para mim me movimentar sem me sentir rígido.A caminhada também tem sido muito dolorosa.;
"228, Artrite: ""Meus músculos foram bastante fracos e meu pescoço foi muito rígido. Minhas articulações estão inchadas, dificultando a caminhada sem me sentir rígida. A caminhada também foi realmente desconfortável"".";
"229, Artrite, ""Eu tenho experimentado uma fraqueza muscular grave, e meu pescoço foi realmente rígido. Eu tenho articulações inchadas e acho difícil se mover sem ficar rígido. Também foi realmente desconfortável andar"".";
230, Artrite, eu tenho me sentido muito fraco nos meus músculos ultimamente e meu pescoço tem sido realmente rígido.Minhas articulações estão inchadas e é difícil para mim me movimentar.Também tem sido doloroso andar.;
231, Artrite, tenho me sentido verdadeiramente frágil nos meus músculos recentemente e meu pescoço tem sido verdadeiramente sólido.As juntas inchadas dificultam a me movimentação.Caminhar também foi difícil.;
"232, Artrite, ""Recentemente, meus músculos se sentiram bastante fracos e meu pescoço foi muito apertado. Eu tenho articulações inchadas, dificultando a me mover. A caminhada também foi dolorosa"".";
"233, Artrite, ""Eu tenho experimentado fraqueza e rigidez muscular recentemente no pescoço. Minhas articulações aumentaram, dificultando a movimentação para mim. A caminhada também foi difícil"".";
234, Artrite, tenho me sentido verdadeiramente frágil nos meus músculos recentemente e meu pescoço tem sido verdadeiramente sólido.Foi difícil para mim me movimentar porque minhas articulações foram inchadas.Caminhar também foi extremamente doloroso.;
"235, Artrite, ""Meus músculos têm se sentindo fracos recentemente, mas meu pescoço foi sólido. Minhas articulações ficaram inchadas, dificultando a mudança. A caminhada também foi bastante desconfortável"".";
"236, Artrite: ""Meus músculos estão se sentindo bastante fracos ultimamente, mas meu pescoço tem sido muito forte. Minhas articulações estão inchadas, tornando -me um desafio para mim. Também foi terrivelmente difícil de caminhar"".";
237, artrite, meu pescoço tem sido extremamente apertado e meus músculos se sentiram bastante fracos recentemente.É difícil para mim me movimentar sem ficar rígido devido às minhas juntas inchadas.Caminhar também foi extremamente desconfortável.;
"238, Artrite: ""Eu tenho experimentado rigidez e fraqueza nos músculos do meu pescoço recentemente. Desde que minhas articulações cresceram, é pesado em nome do estado de pinheiro para correr enquanto não fica rígido. Além disso, a caminhada tem sido terrivelmente desconfortável"".";
"239, Artrite, ""Eu tenho experimentado fraqueza e rigidez muscular recentemente no pescoço. Minhas articulações estão inchadas, criando -a problemática em nome de mim para correr em relação ao não mudar de rígido. A caminhada também tem sido agonizantemente desconfortável"".";
"240, Artrite: ""Meus músculos são bastante fracos e meu pescoço foi muito rígido. Minhas articulações estão inchadas, criando -o problemático em nome de mim para dirigir sobre o respeito, sem se sentir rígido. A caminhada tem sido muito desconfortável"".";
"241, Artrite, ""My Muscles Area Unit bastante fraca e meu pescoço tem sido terrivelmente rígido. Minhas articulações estão inchadas, dificultando a orientação do Maine, enquanto não se sentindo rígido. A caminhada foi terrivelmente desconfortável"".";
"242, Artrite, ""Eu tenho experimentado rigidez e fraqueza nos músculos do meu pescoço recentemente. Desde que minhas articulações cresceram, é onerosa em nome de mim correr, sem obter rígido. Além disso, a caminhada foi extraordinariamente desconfortável"".";
243, Artrite, meu pescoço tem sido muito apertado e meus músculos se sentiram bastante fracos recentemente.É difícil em nome de mim manobrar, sem mudar de rígido graças às minhas articulações inchadas.A caminhada também tem sido muito desconfortável.;
"244, Artrite, ""Recentemente, quando tento andar, tenho rigidez, um pescoço rígido, articulações inchadas e fraqueza muscular. A caminhada também tem sido realmente desconfortável"".";
"245, Artrite, ""Ultimamente, tenho experimentado fraqueza muscular, um pescoço rígido, articulações inchadas e rigidez depois de tentar me movimentar. Também é muito doloroso dirigir"".";
"246, Artrite, ""Recentemente, os músculos do meu pescoço se tornaram apertados e fracos. É difícil para mim correr agora, já que minhas articulações são mais velhas sem ficar apertadas. O ato de caminhar também foi bastante desagradável"".";
"247, Artrite, ""Eu tenho experimentado rigidez e fraqueza nos músculos do meu pescoço recentemente. Desde que minhas articulações cresceram, é pesado em nome do estado americano correr enquanto não fica rígido. Além disso, a caminhada tem sido muito desconfortável"".";
"248, Artrite, ""Recentemente, os músculos do meu pescoço se tornaram apertados e fracos. Desde que minhas articulações amadureceram, é difícil para o governo americano correr sem ficar rígido. A caminhada também tem sido bastante desagradável"".";
"249, Artrite, ""Ultimamente, tenho tido rigidez e fraqueza nos músculos do meu pescoço. Como minhas articulações amadureceram, é difícil para o Estado Americano operar sem se tornar rígido. Além disso, a caminhada tem sido bastante dolorosa"".";
250, acne, tenho tido uma erupção muito ruim na minha pele ultimamente.Está cheio de espinhas e cravos cheias de pus.Minha pele também está correndo muito.;
251, acne, acabei de desenvolver uma erupção grave na minha pele.Está entupido com espinhas e cravos cheias de pus.Minha pele também tem sido bastante sensível.;
"252, acne: ""Minha pele tem surgido em uma erupção terrível recentemente. Cradas e espinhas cheias de pus abundam nela. Além disso, minha pele está correndo muito"".";
"253, acne: ""recentemente tenho experimentado uma erupção cutânea severa. Cravos e espinhas embalados com pus estão por toda parte. Além disso, minha pele está correndo muito"".";
254, acne, tenho uma erupção muito prejudicial à minha pele.Está cheio de espinhas e cravos cheias de pus.Minha pele também tem sido piscadela.;
255, acne, minha pele acaba de adquirir uma erupção cutânea desagradável.Está cheio de espinhas e cravos cheias de pus.Minha pele também tem sido realmente sensível.;
"256, acne, ""Uma erupção cutânea desagradável acaba de aparecer na minha pele. Cravos e espinhas embalados com pus estão por toda parte. Além disso, minha pele tem sido extremamente sensível"".";
"257, acne: ""Recentemente, experimentei uma erupção cutânea severa. Cravos e espinhas cheios de pus estão entupindo. Além disso, minha pele ficou bastante irritada"".";
258, acne, minha pele foi recentemente severamente desagradável.Cravos e espinhas cheias de pus o bloquearam.Minha pele também tem sido bastante delicada.;
259, acne, ultimamente tenho experimentado uma erupção cutânea com muitas espinhas e cravos cheias de pus.Minha pele também está correndo muito.;
"260, acne, ""Uma erupção cutânea com várias espinhas e cravos cheias de Pus tem me incomodado ultimamente. Além disso, minha pele está correndo muito"".";
261, acne, minha pele agora desenvolveu uma erupção cutânea revoltante.Existem espinhas e cravos cheias de pus por toda parte.Minha pele também tem sido realmente sensível.;
"262, acne: ""Minha pele desenvolveu uma erupção horrível. Há cravos e espinhas cheias de pus em todos os lugares. Além disso, minha pele tem sido extremamente sensível"".";
"263, acne, ""Uma erupção cutânea desagradável acaba de aparecer na minha pele. Cravos e espinhas embalados com pus estão por toda parte. Além disso, minha pele tem sido extremamente sensível"".";
264, acne, minha pele tem simplesmente uma erupção cutânea desagradável.Está repleto de espinhas e cravos cheias de pus.Além disso, minha pele tem sido muito sensível.;
"265, acne: ""Minha pele desenvolveu uma erupção terrível que não é herdada. Ela tem muitos cravos e espinhas cheias de pus. Além disso, minha pele tem sido extremamente sensível"".";
"266, acne: ""Recentemente, eu tenho experimentado muitas fugas de acne com espinhas que contêm pus. Eu também tenho lutado com cravos"".";
267, acne, acordei esta manhã e descobri que tenho uma erupção cutânea muito desagradável em toda a minha pele.Há uma tonelada de cravos e espinhas que são preenchidos com pus.Minha pele também tem sido realmente correndo.;
268, acne, eu tenho notado uma erupção cutânea muito desagradável na minha pele ultimamente.Está coberto de cravos e espinhas que são embalados com pus.Minha pele também tem sido realmente correndo.;
269, acne, acabei de desenvolver uma erupção cutânea muito desagradável na minha pele.Existem toneladas de cravos e espinhas que são preenchidos com pus.Minha pele também tem sido realmente correndo.;
270, acne, tenho lidado com uma erupção cutânea realmente desagradável na minha pele ultimamente.Está coberto de cravos e espinhas que são embalados com pus.Minha pele também tem sido realmente correndo.;
271, acne, acordei esta manhã para encontrar uma erupção cutânea realmente desagradável na minha pele.Há uma tonelada de cravos e espinhas que são preenchidos com pus.Minha pele também tem sido realmente correndo.;
272, acne, tenho lutado com uma erupção cutânea realmente desagradável na minha pele ultimamente.Está coberto de cravos e espinhas que são embalados com pus.Minha pele também tem sido realmente correndo.;
273, acne, acabei de desenvolver uma erupção cutânea muito desagradável na minha pele.Existem toneladas de cravos e espinhas que são preenchidos com pus.Minha pele também tem sido realmente correndo.;
274, acne, tenho lidado com uma erupção cutânea realmente desagradável na minha pele ultimamente.Está coberto de cravos e espinhas que são embalados com pus.Minha pele também tem sido realmente correndo.;
275, acne, desenvolvi recentemente uma erupção terrível na minha pele.Está cheio de cravos e espinhas cheias de pus.Minha pele também está correndo em todos os lugares.;
276, acne, recentemente tive uma erupção horrível na minha pele.Existem várias cravos e espinhas cheias de pus.Minha pele também está se movendo muito.;
"277, acne: ""Esta manhã, quando acordei, descobri que tenho uma erupção cutânea extremamente ruim em todo o meu corpo. Existem várias espinhas e cravos cheias de pus ao redor. Minha pele também está se movendo muito"".";
278, acne, acordei esta manhã para ver que tinha uma erupção horrível em toda a minha pele.Existem vários cravos e espinhas carregados com pus.Minha pele também tem correr.;
279, acne, acabei de desenvolver uma erupção cutânea com várias espinhas e cravos cheias de pus.Minha pele também tem sido bastante sensível.;
"280, acne, ""Uma erupção cutânea com várias espinhas e cravos cheias de Pus está me incomodando ultimamente. Além disso, minha pele está correndo muito"".";
"281, acne: ""Acordei esta manhã para descobrir que tenho uma erupção terrível em todo o meu corpo. Cradas e espinhas cheias de pus estão por todo o lado. Além disso, minha pele está mudando muito"".";
"282, acne: ""Quando acordei esta manhã, percebi que tinha uma erupção cutânea severa em todo o meu corpo. Existem muitas espinhas e cravos cheias de pus por todo o lugar. Minha pele também está correndo muito"".";
283, acne, desenvolvi recentemente uma erupção terrível na minha pele.Está cheio de cravos e espinhas cheias de pus.Minha pele também tem correr.;
284, acne, acordei esta manhã para ver uma erupção horrível na minha pele.Existem vários cravos e espinhas carregados com pus.Minha pele também tem correr.;
"285, acne: ""Esta manhã, quando acordei, descobri uma erupção cutânea extremamente ruim na minha pele. Existem várias espinhas cheias de pus e cravos ao redor. Minha pele também está se movendo muito"".";
286, acne, recentemente luta contra uma erupção cutânea na minha pele.Existem espinhas e cravos cheias de pus por toda parte.Minha pele também está correndo muito.;
"287, acne: ""Esta manhã, percebi que tinha uma grande erupção cutânea em todo o meu corpo. Há muitas espinhas cheias de pus e cravos por toda parte, e minha pele está muito correndo muito"".";
"288, acne: ""Acordei hoje para descobrir que tive uma grande erupção cutânea em todo o meu corpo. Há muitas espinhas cheias de pus e cravos por toda parte, e minha pele está muito correndo muito"".";
