,Doença, Sintomas;
"260, dengue: ""Estou sentindo dores nas costas que são piores quando sento ou mantenho há muito tempo. Além disso, há erupções cutâneas em todo o meu corpo. Há uma dor por trás dos meus olhos também"".";
261, dengue, a erupção cutânea que desenvolvi é acompanhada de vermelhidão e inchaço.Não me sinto bem, pois tenho febre severa acompanhada de dor corporal.;
262, dengue, os calafrios e tremendo que eu tenho experimentado são acompanhados por um sentimento de frieza e febre alta.Também desenvolvi erupções cutâneas nos braços e manchas vermelhas no pescoço.;
"263, dengue, ""A dor nas articulações que tenho experimentado é severa e parece uma dor constante. Minha cabeça dói na maioria das vezes e estou começando a desenvolver a febre suave, acompanhada de calafrios"".";
264, dengue, o vômito que tenho experimentado é acompanhado por cólicas estomacais e tonturas.Perdi meu apetito e me sinto fraco como resultado.Há uma dor por trás dos meus olhos também.;
265, dengue, a febre alta que tenho experimentado é acompanhada de suor e fraqueza.Como resultado, meus músculos não posso trabalhar o dia todo.;
"266, dengue, ""O cansaço que sinto é extremo e dificulta a execução de tarefas básicas. Sinto -me vomitando e desenvolvi erupções cutâneas nos braços, pescoço e pernas"".";
267, dengue, a dor de cabeça que tenho experimentado é severa e é acompanhada por uma sensação de pressão na minha cabeça.Tenho febre suave junto com dor de cabeça.Existem pequenas manchas vermelhas nas minhas costas.;
268, dengue, a náusea que sinto é acompanhada por uma perda de apetite e sentimento de desconforto.Há uma dor distinta nas costas e na dor muscular também.;
269, dengue, a dor muscular que tenho experimentado é severa e parece uma dor constante.Existem manchas vermelhas em todo o meu corpo e a coceira está me causando muito desconforto.;
"270, dengue: ""Eu desenvolvi uma erupção cutânea que cobre todo o meu corpo e é acompanhada por uma coceira intensa. Meu corpo dores e eu tenho uma febre suave, acalmada com dor de cabeça e calafrios"".";
"271, dengue: ""Estou experimentando extrema dor corporal, dor de cabeça e vômito. Desenvolvi manchas vermelhas que cobrem todo o meu corpo e causam coceira grave"".";
"272, dengue: ""Minhas costas dói o tempo todo, e meus braços e pescoço têm erupções cutâneas. As costas dos olhos são muito dores. Eu também tenho febre e está deixando nos preocupando com minha saúde"".";
"273, dengue: ""Eu tenho sofrido de dor nas articulações significativas, o que dificulta a caminhada e a execução de minhas tarefas diárias. Também perdi meu apetite, o que me faz sentir fraco e sentir como vomitar"".";
274, dengue, há uma constante atrás dos meus olhos.Eu desenvolvi manchas vermelhas no pescoço e no rosto e erupções cutâneas nos meus braços.Meus braços e pernas dores muito..Os pontos são coceira e desconfortável e isso me preocupa.;
"275, dengue: ""Estou me sentindo doente e sinto uma forte necessidade de vomitar. Há uma dor aguda atrás dos meus olhos e pontos vermelhos inchados por todas as minhas costas"".";
276, dengue, meus arrepios e tremores foram acompanhados de uma sensação de frieza e uma febre muito alta.Apareceu erupções cutâneas nos meus braços e manchas vermelhas no meu pescoço também apareceram.;
"277, dengue, ""tenho sofrido de dor nas articulações graves. Sinto vomitando a maior parte do tempo e estou desenvolvendo uma febre moderada com calafrios. A febre que parece não cair mesmo com medicamentos"".";
"278, dengue, ""o vômito que tenho sido seguido foi seguido por dores de estômago e tontura. Perdi meu apetite e, como resultado, parecem fracos. Meus braços, costas, dor no pescoço na maioria das vezes"".";
279, dengue, desenvolvi manchas vermelhas em meus braços e pernas com coceira e inflamada.Eu tenho me sentido enjoado e tenho um desejo constante de vomitar.Isso é acompanhado por febre leve.;
"280, dengue: ""Eu desenvolvi uma erupção cutânea que cobre todo o meu corpo. A erupção cutânea é vermelha e inchada e é pior em certas áreas, como meus braços e pernas. Também perdi meu apetite"".";
281, dengue, eu tenho experimentado calafrios e tremendo.Há uma forte dor nas costas e também atrás dos meus olhos.Eu também notei pequenas manchas vermelhas nas costas e pescoço.;
282, dengue, tenho experimentado uma forte dor nas articulações que está dificultando o meu dia.Eu sinto vontade de vomitar o tempo todo e também tenho uma leve dor de cabeça.;
"283, dengue, ""tenho vomitado com frequência e perdi meu apetite como resultado. Há erupções cutâneas na minha pele e nos olhos da dor, por causa dos quais não consigo dormir corretamente"".";
284, dengue, tenho uma febre alta junto com uma forte dor de cabeça.A febre é acompanhada por extrema dor corporal e calafrios.Estou preocupado com minha saúde e não sei o que fazer.;
"285, dengue: ""Eu tenho me sentido extremamente cansado e cansado, e não tenho energia para fazer qualquer coisa. O cansaço é tão grave que luto para sair da cama. Notei pequenos manchas vermelhas nos meus braços e pernas"".";
286, dengue, tenho experimentado uma forte dor de cabeça que é acompanhada pela dor atrás dos meus olhos.Sinto -me cansado e cansado por causa do qual não posso trabalhar o dia todo.Estou preocupado com minha saúde.;
"287, dengue, ""tenho me sentido enjoado e tenho um desejo constante de vomitar, que é acompanhado de febre suave e dor de cabeça"".";
288, dengue, desenvolvi erupções cutâneas no meu corpo que estão com coceira e.Perdi meu apetite e me sinto muito cansado o dia todo.Eu sinto que algo está errado com meu corpo.;
"289, dengue: ""Eu tenho sofrido dor muscular e dor de cabeça. A dor muscular parece uma dor constante e é pior quando tento usar os músculos afetados. Há pequenos pontos vermelhos em meu rosto, pescoço e braços"".";
"290, dengue, ""minhas costas dói e eu tenho erupções cutâneas nos braços e axilas. As costas dos meus olhos doem muito. Eu também tenho uma febre suave, o que está nos preocupando com minha saúde"".";
"291, dengue: ""Estou experimentando febre muito alta e calafrios todas as noites. É realmente preocupante para mim. Além disso, não sinto vontade de comer nada e minhas costas, braços, pernas muito dores. Há uma dor estranha por estar nos olhos. Não posso fazer nenhuma atividade física"".";
"292, dengue, ""Como resultado do meu vômito regular, perdi meu apetite. Meus músculos, articulações e de volta constantemente doem. Estou começando a ter febre também. Estou realmente preocupado e não tenho certeza do que fazer"".";
293, dengue, eu tenho experimentado uma febre grave que é acompanhada de dor atrás dos olhos e dor de cabeça. Sinto -me cansado e expresso por causa do qual não posso fazer nenhum trabalho.;
"294, dengue, ""meu corpo inteiro está tendo muita coisa e não sinto vontade de comer nada. Tenho febre suave e fico calafrios todas as noites. Além disso, há alguns pontos vermelhos se desenvolvendo nas costas e pescoço"".";
"295, dengue, ""minhas articulações e dor nas costas todos os dias. Sinto vontade de vomitar e isso me deixou muito fraco. Por causa da dor do meu corpo, não consigo me concentrar no meu trabalho e não sinto vontade de fazer nada"".";
296, dengue, a dor corporal que sinto é extrema. Perdi meu apetite e desenvolvi erupções cutâneas nos braços e no rosto. A parte de trás dos meus olhos é muito dor.;
297, dengue, desenvolvi erupções cutâneas no meu corpo.Também estou experimentando febre alta junto com calafrios e dor de cabeça.Minhas articulações e costas doíam e há uma dor estranha nas costas dos meus olhos.;
"298, dengue: ""Estou me sentindo enjoado e tenho um desejo constante de vomitar. Fico com febre alta e calafrios todas as noites e me sinto péssima por causa disso. Além disso, sinto que perdi meu apetite"".";
"299, dengue: ""Há erupções cutâneas na minha pele, o que coceira se eu tocá -las. Não me sinto bem como minhas articulações dores o dia inteiro. À noite, tenho febre suave e fico arrepiante, por causa da qual também não consigo dormir"".";
"0, infecção fúngica: ""Eu levantei nódulos, uma erupção cutânea que parece vermelha e inflamada, áreas descoloridas da pele que são cores diferentes do resto da minha pele e coceira na minha pele"".";
"1, infecção fúngica: ""Em todo o meu corpo, houve uma coceira severa que foi seguida por uma erupção cutânea vermelha e esburacada. Minha pele também tem alguns pontos escuros e alguns pequenos e nodulares.";
"2, infecção fúngica: ""Eu tive uma erupção cutânea na minha pele que se parece com remendos discréticos, e também tenho muitas erupções nodulares e coceira muito ruim. Durante a semana anterior, ficou pior"".";
"3, infecção fúngica: ""Eu tive uma erupção cutânea que não desapareceu e uma coceira incômoda na minha pele. Além disso, vi algumas áreas diferentes e inchaços que se assemelham a nós ou nódulos na minha pele"".";
"4, infecção fúngica: ""Eu tenho uma erupção cutânea em todo o meu corpo e não consigo parar de coçar porque minha pele está com coceira. Minha pele também tem alguns pontos onde o tom é alterado e alguns caroços e espinhas de nó"".";
"5, infecção fúngica: ""Recentemente, minha pele está com muita coceira, e eu tenho uma erupção cutânea em todo o meu corpo. Minha pele também tem alguns pontos onde o tom é alterado e alguns caroços e espinhas de nó"".";
"6, infecção fúngica: ""Minha pele está com muita vontade e desenvolvendo uma erupção cutânea. Além disso, tenho algumas áreas da minha pele que são uma tonalidade diferente do resto. Além disso, tenho algumas espinhas ou fugas firmes na minha pele"".";
"7, infecção fúngica, ""em todo o meu corpo está com coceira como uma loucura, e agora existem áreas vermelhas por toda parte. Além disso, alguns dos remendos têm um tom diferente da minha pele natural. E na minha pele, existem esses pedaços ou espinhas que se desenvolveram"".";
"8, infecção fúngica: ""Minha pele está agindo recentemente, tornando-se extremamente coceira e propensa a erupções cutâneas. Além disso, existem certos pontos que se desviam do meu tom de pele natural em termos de matiz. E agora minha pele tem esses caroços ou inchaços que não estavam lá antes"".";
"9, infecção fúngica, ""Nos meus braços e pernas, tenho muitas espinhas vermelhas e coceira. Minha pele também tem algumas lesões de aparência estranha. E, ocasionalmente, existem solavancos que são um pouco desconfortáveis"".";
10, infecção por fungos, tenho uma pele com coceira e muitos solavancos vermelhos nos meus braços e pernas.Existem alguns pontos de aparência estranha na minha pele também.E às vezes há solavancos que parecem meio difíceis.;
"11, infecção por fungos: ""Doutor, eu tenho uma erupção cutânea na minha pele e há alguns pontos estranhos que são uma cor diferente. Também existem alguns solavancos na minha pele que parecem pequenos nós""";
"12, infecção por fungos, ""Doutor, minha pele está coberta por uma erupção cutânea muito desconfortável, juntamente com algumas manchas estranhas de uma tonalidade diferente. Minha pele também tem algumas espinhas que se assemelham a pequenos nós""";
"13, infecção fúngica: ""Tenho muitos pontos de coceira na minha pele e, às vezes, ficam vermelhos ou esburacados. Também existem alguns remendos estranhos que são cores diferentes do resto da minha pele, e às vezes recebo esses solavancos estranhos que parecem bolinhos"".";
"14, infecção fúngica: ""Minha pele freqüentemente desenvolve inchaços que podem ocasionalmente ficar vermelhos ou ásperos. Além disso, minha pele ocasionalmente desenvolve espinhas estranhas que se assemelham a bolas pequenas e alguns pontos estranhos que são um tom diferente do resto da minha pele"".";
"15, infecção fúngica: ""Doutor, eu tenho essas erupções vermelhas que continuam aparecendo e minha pele está continuamente com coceira. Além disso, observei alguns pontos de cor estranhos na minha pele, além de alguns pequenos nódulos na minha pele que parecem estar se expandindo"".";
"16, infecção fúngica: ""Eu tenho experimentado uma coceira realmente intensa por todo o meu corpo, junto com vermelhidão e solavancos na minha pele. Também existem esses remendos estranhos que são cores diferentes do resto da minha pele, e às vezes recebo esses nódulos que parecem pequenos inchaços"".";
"17, infecção fúngica: ""Em todo o meu corpo, eu tenho coçado tanto que minha pele se tornou vermelha e desenvolveu espinhas. Além disso, ocasionalmente recebo esses nódulos que se assemelham a pequenas espinhas, bem como essas manchas estranhas que são um tom diferente do resto da minha pele"".";
"18, infecção fúngica: ""Eu tenho experimentado muita coceira, que foi acompanhada de uma erupção cutânea que parece estar piorando com o tempo. Também existem certas áreas de pele que são cores diferentes do resto, e eu vi vários pedaços que se assemelham a pequenos nós"".";
"19, infecção fúngica: ""Eu tenho tido muitos problemas com a coceira e foi acompanhado por uma erupção cutânea que parece estar piorando com o tempo. Também existem alguns manchas de pele que são cores diferentes das resto, e eu notei alguns inchaços que parecem pequenos nós"".";
"20, infecção por fungos, ""Doutor, minha pele é coberta por uma erupção cutânea desconfortável e tem algumas manchas estranhas de pele que são uma cor diferente. Existem algumas espinhas na minha pele que se assemelham a pequenos nós"".";
"21, infecção fúngica: ""Eu tenho ido muito, e ela foi acompanhada de uma erupção cutânea que parece estar piorando com o tempo. Também existem alguns trechos de pele que são cores diferentes do resto da pele, além de alguns pedaços que se assemelham a pequenos nós"".";
"22, infecção fúngica: ""Minha pele tem atuado ultimamente, tornando -se extremamente coceira e propenso a erupções cutâneas. Além disso, várias manchas diferem do meu tom de pele normal em termos de cor. E agora tenho nódulos ou solavancos na minha pele que não estavam lá antes"".";
"23, infecção fúngica, ""Uma erupção cutânea que parece estar se desenvolvendo em toda a minha pele, acompanha minhas recentes crises de coceira e desconforto intensos. Na minha pele, também tenho alguns pontos discrômicos e pequenos pedaços que parecem estar aparecendo em todos os lugares"".";
"24, infecção fúngica: ""Minha pele sempre coceira e, ocasionalmente, ela se torna bastante áspera e vermelha. Além disso, ocasionalmente recebo pequenas espinhas que se assemelham a pequenas bolas e certos pontos que são uma cor diferente do resto da minha pele. Isso me irrita severamente e coceira"".";
"25, infecção fúngica: ""Eu tenho muita coceira em toda a minha pele e, às vezes, fica realmente vermelha e esburacada. Também existem alguns remendos que são cores diferentes do resto da minha pele, e às vezes recebo esses pequenos solavancos que parecem bolinhos. É realmente irritante e coceira"".";
"26, infecção fúngica: ""Eu tenho uma coceira bastante irritante em todo o meu corpo, e minha pele também tem algumas áreas vermelhas e esburacadas. Também tive algumas espinhas que se assemelham a bolas pequenas e outros pontos que são uma cor diferente do resto da minha pele"".";
"27, infecção fúngica: ""Eu tive uma coceira bastante desconfortável em todo o meu corpo, além de áreas vermelhas e esburacadas na minha pele. Também existem certos manchas da minha pele que são um tom diferente do resto, e eu tive algumas espinhas que se assemelham a bolas pequenas"".";
"28, infecção fúngica: ""Eu tenho tido essa coceira realmente irritante em todo o meu corpo, e também tenho pontos vermelhos e esburacados na minha pele. Também existem algumas áreas que são uma cor diferente do resto da minha pele, e eu tive alguns solavancos que parecem bolinhos"".";
"29, infecção fúngica: ""Eu tive uma coceira bastante desconfortável em todo o meu corpo, bem como áreas vermelhas e esburacadas na minha pele. Também existem certos trechos da minha epiderme com um tom distinto do que o resto, e eu tive algumas espinhas que se assemelham a bolas"".";
"30, infecção fúngica: ""Ultimamente, estou com coceira e existem esses pontos de aterramento em toda a minha pele. Também existem algumas áreas que parecem diferentes em sombra do que o resto da minha pele, e eu tive alguns solavancos que são meio difíceis"".";
"31, infecção fúngica: ""Recentemente, estou com muita coceira, e tenho manchas efixos em toda a minha pele. Também existem certas regiões de cor mais escura que o resto da minha pele, e eu tenho alguns pedaços firmes"".";
"32, infecção fúngica, ""Recentemente, tenho coceira e tenho manchas efixos em toda a minha pele. Também existem certas regiões de cor mais escura do que o resto da minha pele, e eu tenho alguns nódulos dolorosos"".";
"33, infecção fúngica: ""Recentemente, eu tenho me arranhado muito, e minha pele está coberta de lugares com rapidez. Além disso, eu tive algumas espinhas que são bastante firmes e há certos pontos no meu corpo que têm um tom diferente de marrom do que o resto da minha pele"".";
"34, infecção fúngica: ""Minha pele tem sido realmente coceira e há esses pontos de rapidez por toda parte. Também existem alguns remendos que parecem diferentes em cores do resto da minha pele, e eu tive alguns solavancos que são meio difíceis"".";
"35, infecção fúngica: ""Minha pele tem sido realmente arranhada, e há erupções cutâneas em todo o meu corpo. Tenho alguns solavancos que são bastante firmes, além de algumas áreas que são um tom mais escuro do resto da minha pele. É extremamente desagradável"".";
"36, infecção fúngica, ""Existem áreas de rapidez em toda a minha pele, que tem sido realmente irritante. Além disso, tenho alguns inchaços bastante firmes e alguns remendos que são uma cor diferente do resto da minha pele"".";
"37, Infecção por fungos: ""Recentemente, eu tenho me arranhado muito, e minha pele está coberta de lugares com rapidez. Além disso, existem alguns pontos em que minha pele não parece ser sua tonalidade usual, e eu experimentei alguns pedaços que são bastante dolorosos"".";
"38, infecção fúngica: ""Estou realmente coceira ultimamente e há esses pontos de aterramento em toda a minha pele. Também existem algumas áreas que não se parecem com a cor normal da minha pele, e eu tive alguns solavancos que são meio que duros""";
"39, infecção por fungos: ""Recentemente, tenho coceira e tenho lugares desagradáveis ​​em todo o meu corpo. Também existem algumas regiões que não parecem ser o tom típico da minha pele e experimentei alguns pedaços firmes"".";
"40, infecção fúngica: ""Estou comichão e tenho manchas desagradáveis ​​em toda a minha pele recentemente. Também existem algumas regiões que não parecem ser o tom regular da minha pele, e eu experimentei alguns solavancos dolorosos"".";
"41, infecção fúngica: ""Recentemente, eu me aliando muito, e minha pele está coberta de remendos de rapidez. Além disso, existem algumas regiões onde minha pele não parece ser seu tom habitual, e eu experimentei alguns pedaços excepcionalmente dolorosos"".";
"42, infecção fúngica: ""Eu tenho tido essa coceira constante e há esses pontos vermelhos e esburacados na minha pele. Também existem alguns remendos que são uma cor diferente do resto da minha pele, e eu tive alguns solavancos que são como pequenos pedaços"".";
"43, infecção fúngica: ""Há áreas vermelhas e irregulares na minha pele, e eu tenho me arranhado sem parar. Além disso, tenho alguns inchaços que se assemelham a pequenos pedaços e alguns pontos que são um tom diferente de pele do que o resto do meu corpo"".";
"44, infecção fúngica: ""Eu tive muita coceira na minha pele, que ocasionalmente se transforma em uma erupção cutânea. Também existem algumas manchas estranhas de pele que são uma tonalidade diferente do resto de mim, e ocasionalmente recebo pequenas espinhas que se assemelham a nódulos"".";
"45, infecção fúngica: ""Eu tive uma tendência de coçar na minha pele, que frequentemente se transforma em uma erupção cutânea. Também existem alguns manchas estranhas de pele que são um tom diferente do resto da minha pele, e eu regularmente recebo pequenos pedaços que imitam nódulos"".";
"46, infecção fúngica: ""Eu tenho experimentado muita coceira na minha pele e, às vezes, ela se transforma em uma erupção cutânea. Também existem algumas manchas estranhas de pele que são uma cor diferente do resto de mim, e às vezes recebo pequenos inchaços que parecem nódulos"".";
"47, infecção fúngica: ""Meu corpo está coçando terrivelmente por toda parte, e agora há manchas vermelhas em todos os lugares. Alguns dos patches também diferem em tom da minha pele natural. E existem esses caroços ou espinhas que apareceram na minha pele"".";
"48, infecção fúngica: ""Minha pele tem sido realmente coceira ultimamente e ocasionalmente entra em erupção cutânea.";
49, infecção fúngica, agora há manchas vermelhas em todo o meu corpo, onde eu tenho ido horrivelmente por toda parte. Alguns dos remendos também diferem em tez da minha pele natural. E esses caroços ou solavancos se desenvolveram na minha pele.;
"50, frio comum: ""Não consigo parar de espirrar e meu nariz está realmente escorrendo. Também estou muito frio e cansado o tempo todo, e tenho tossido muito. Minha febre também está muito alta, muito acima do normal"".";
"51, resfriado comum: ""Meu nariz é extremamente escorrendo e não consigo parar de espirrar. Além disso, sinto -me constantemente frio, exausto e tenho tossido muito. Minha febre também é muito alta muito acima do normal"".";
"52, Frio comum: ""Eu estive espirrando sem parar e não consigo agitar esse frio. Estou me sentindo muito fraco e cansado, e minha tosse não vai embora. Minha febre está muito alta""";
"53, Frio comum: ""Eu estive espirrando incessantemente e simplesmente não consigo fazer esse calafrio para desaparecer. Sinto -me tão fraco e exausto e minha tosse não parará. Minha temperatura está realmente alta"".";
54, Frio comum, estou constantemente espirrando e meu corpo está tremendo por estar frio.Estou tão cansado que mal consigo me mexer e minha cabeça está me matando.Minha febre é através do telhado;
"55, frio comum: ""Estou constantemente espirrando, e o frio está fazendo meu corpo tremer. Estou tão exausto que mal posso me mover e minha cabeça dói. Minha febre está muito alta"".";
"56, frio comum: ""Eu estive bastante exausto e doente. Estou espirrando sem parar e estou com bastante frio. Minha cabeça está latejando e não tenho energia. Além disso, tenho uma febre muito alta e sinto que estou pegando fogo"".";
"57, Frio comum: ""Eu tenho me sentido muito cansado e doente. Eu tenho espirrado muito e não consigo me aquecer. Estou tão cansado e minha cabeça está me matando. E minha febre está muito alta, como se estivesse fervendo"".";
"58, Frio comum: ""Eu estive bastante exausto e doente. Minha garganta tem sido bastante dolorosa e tive uma tosse bastante desagradável. Eu tenho muitos calafrios e uma temperatura bem alta. Apenas me sentindo extremamente atropelado e fraco""";
"59, frio comum: ""Eu estive bastante exausto e doente. Estou espirrando muito e estou tendo problemas para me aquecer. Estou tão exausta e minha cabeça dói. E sinto que estou fervendo com minha alta temperatura"".";
60, resfriado comum, não consigo parar de espirrar e me sinto muito cansado e ruim.Minha garganta está realmente dolorida e eu tenho muitas coisas irritadas no nariz e na garganta.Meu pescoço parece inchado e inchado também.;
"61, frio comum: ""Não consigo parar de espirrar, e estou exausto e doente. Minha garganta é realmente desconfortável, e há muito lixo no nariz e na garganta. Meu pescoço também está inchado e inchado"".";
"62, frio comum: ""Eu continuo espirrando e estou infeliz e exausta. Tenho muitas coisas irritadas no nariz e na garganta, e minha garganta está realmente doendo. Meu pescoço também parece inchado e inchado"".";
63, resfriado comum, estou me sentindo realmente exausto e doente do estômago. Eu tive uma tosse muito ruim e minha garganta machucou muito. Eu experimentei pressão substancial do seio e um nariz congestionado. Estou realmente desagradável e desgastado.;
64, resfriado comum, eu tenho espirrado muito e me sentindo muito cansado e doente.Há também muitas coisas grosseiras saindo do meu nariz e minha garganta parece realmente arranhada.E meu pescoço também parece inchado.;
"65, frio comum: ""Eu tenho chiado muito e geralmente estou me sentindo doente e exausto. Minha garganta se sente muito arranhada, e muitas coisas grosseiras estão escorrendo do meu nariz. Meu pescoço também parece inchado"".";
"66, resfriado comum: ""Meus seios se sentem incrivelmente congestionados e meus olhos estão continuamente vermelhos. Eu apenas me sinto constantemente drenada e exausta. Além disso, tenho muita catarro desconfortável na garganta. Meus linfonodos se sentem inchados e a respiração tem sido um desafio"".";
67, resfriado comum, meus olhos foram realmente vermelhos e meus seios se sentem congestionados. Eu simplesmente não tenho energia e minha garganta tem sido realmente coceira. Eu também notei que meus linfonodos estão inchados e tenho tossido muita fleuma.;
